GEO.id,GEO.id2,GEO.display-label,HD01_VD01,HD02_VD01,HD01_VD02,HD02_VD02,HD01_VD03,HD02_VD03,HD01_VD04,HD02_VD04,HD01_VD05,HD02_VD05,HD01_VD06,HD02_VD06,HD01_VD07,HD02_VD07,HD01_VD08,HD02_VD08,HD01_VD09,HD02_VD09,HD01_VD10,HD02_VD10
Id,Id2,Geography,Estimate; Total:,Margin of Error; Total:,Estimate; Enrolled in school:,Margin of Error; Enrolled in school:,"Estimate; Enrolled in school: - Enrolled in nursery school, preschool","Margin of Error; Enrolled in school: - Enrolled in nursery school, preschool",Estimate; Enrolled in school: - Enrolled in kindergarten,Margin of Error; Enrolled in school: - Enrolled in kindergarten,Estimate; Enrolled in school: - Enrolled in grade 1 to grade 4,Margin of Error; Enrolled in school: - Enrolled in grade 1 to grade 4,Estimate; Enrolled in school: - Enrolled in grade 5 to grade 8,Margin of Error; Enrolled in school: - Enrolled in grade 5 to grade 8,Estimate; Enrolled in school: - Enrolled in grade 9 to grade 12,Margin of Error; Enrolled in school: - Enrolled in grade 9 to grade 12,"Estimate; Enrolled in school: - Enrolled in college, undergraduate years","Margin of Error; Enrolled in school: - Enrolled in college, undergraduate years",Estimate; Enrolled in school: - Graduate or professional school,Margin of Error; Enrolled in school: - Graduate or professional school,Estimate; Not enrolled in school,Margin of Error; Not enrolled in school
310M300US10100,10100,"Aberdeen, SD Micro Area",41002,169,10317,332,646,147,565,139,2608,213,1939,211,2132,166,2026,286,401,140,30685,360
310M300US10140,10140,"Aberdeen, WA Micro Area",69154,201,14589,400,1099,224,744,162,3164,318,3441,335,3438,222,2511,316,192,74,54565,379
310M300US10180,10180,"Abilene, TX Metro Area",162031,465,44443,1053,2714,443,2510,352,8773,492,8527,466,8555,423,11637,999,1727,301,117588,1042
310M300US10220,10220,"Ada, OK Micro Area",36669,106,10251,282,753,99,555,115,2061,165,2007,136,1802,160,2703,282,370,109,26418,272
310M300US10300,10300,"Adrian, MI Micro Area",95432,187,23750,515,1345,173,1111,169,4674,269,4914,293,5521,262,5622,431,563,143,71682,537
310M300US10420,10420,"Akron, OH Metro Area",681374,683,177926,1752,10466,653,7144,610,32502,1064,33324,1052,36770,837,46857,1511,10863,696,503448,1768
310M300US10460,10460,"Alamogordo, NM Micro Area",62398,260,15909,545,946,274,1214,288,3080,312,3579,409,3047,208,3371,425,672,231,46489,496
310M300US10500,10500,"Albany, GA Metro Area",148124,443,46565,948,3414,462,2024,325,8856,498,8199,496,9956,538,12555,849,1561,299,101559,881
310M300US10540,10540,"Albany, OR Metro Area",116568,262,27809,664,1133,187,1503,279,6610,397,6086,412,6210,312,5440,611,827,171,88759,627
310M300US10580,10580,"Albany-Schenectady-Troy, NY Metro Area",854415,634,218907,1785,12076,717,9191,632,38677,1027,40481,1174,42920,815,61554,1472,14008,886,635508,1735
310M300US10620,10620,"Albemarle, NC Micro Area",58743,201,13453,381,603,161,765,191,2937,272,3039,287,3126,235,2615,339,368,98,45290,405
310M300US10660,10660,"Albert Lea, MN Micro Area",29624,97,6556,200,437,112,436,96,1488,129,1521,114,1569,108,909,122,196,87,23068,199
310M300US10700,10700,"Albertville, AL Micro Area",91278,282,22374,585,1347,249,1018,213,5332,363,5709,428,5105,253,3406,415,457,133,68904,662
310M300US10740,10740,"Albuquerque, NM Metro Area",873739,906,239192,2106,11859,807,11893,1001,46612,1229,47923,1241,49374,972,56980,1684,14551,796,634547,1956
310M300US10760,10760,"Alexander City, AL Micro Area",39696,200,8799,476,659,221,568,182,2073,262,1799,212,1871,195,1593,347,236,130,30897,460
310M300US10780,10780,"Alexandria, LA Metro Area",147850,377,38354,826,2390,382,2445,363,8459,536,8587,573,8591,401,6815,617,1067,301,109496,821
310M300US10820,10820,"Alexandria, MN Micro Area",35606,128,7890,333,570,93,404,92,2053,170,1678,169,1590,107,1395,344,200,68,27716,345
310M300US10860,10860,"Alice, TX Micro Area",39364,255,10807,445,856,309,677,218,2626,295,2361,350,2873,239,1270,282,144,107,28557,436
310M300US10900,10900,"Allentown-Bethlehem-Easton, PA-NJ Metro Area",807301,740,197193,1597,10849,741,10057,647,38868,1024,42003,1145,43289,814,44240,1158,7887,603,610108,1597
310M300US10940,10940,"Alma, MI Micro Area",40138,88,9880,281,465,100,400,74,1848,168,2071,193,2163,118,2703,251,230,71,30258,266
310M300US10980,10980,"Alpena, MI Micro Area",27979,81,5822,218,252,80,304,73,1090,124,1277,130,1451,123,1263,175,185,76,22157,228
310M300US11020,11020,"Altoona, PA Metro Area",121005,276,26358,579,2054,263,1400,206,5532,393,5997,357,5751,248,4904,466,720,175,94647,503
310M300US11060,11060,"Altus, OK Micro Area",24184,137,6430,295,514,109,395,99,1454,138,1437,180,1209,106,1174,198,247,98,17754,231
310M300US11100,11100,"Amarillo, TX Metro Area",250982,409,71639,1017,4962,458,4112,343,16082,686,14120,668,14398,456,15312,720,2653,371,179343,997
310M300US11140,11140,"Americus, GA Micro Area",34494,185,10685,374,581,166,581,180,2087,232,1929,294,2060,224,3111,354,336,119,23809,378
310M300US11180,11180,"Ames, IA Metro Area",93041,246,43483,745,1076,209,1246,250,3312,203,3858,309,3326,231,26381,704,4284,501,49558,677
310M300US11220,11220,"Amsterdam, NY Micro Area",47726,141,11306,362,660,171,613,133,2477,196,2483,222,2661,144,1894,219,518,127,36420,345
310M300US11260,11260,"Anchorage, AK Metro Area",381864,534,104574,1429,5036,462,5397,494,21125,682,21890,762,22790,559,22617,1037,5719,528,277290,1462
310M300US11380,11380,"Andrews, TX Micro Area",16566,125,4586,217,353,108,296,117,1395,241,1025,222,1142,137,332,128,43,44,11980,239
310M300US11420,11420,"Angola, IN Micro Area",33406,157,8234,300,396,132,494,155,1485,170,1752,193,1994,184,1897,204,216,104,25172,318
310M300US11460,11460,"Ann Arbor, MI Metro Area",350599,369,125917,1239,5049,408,3899,375,15486,586,15575,556,17396,492,50530,1094,17982,864,224682,1222
310M300US11500,11500,"Anniston-Oxford-Jacksonville, AL Metro Area",111931,346,27798,746,1727,349,1473,265,5281,415,6220,398,5728,308,6452,574,917,297,84133,821
310M300US11540,11540,"Appleton, WI Metro Area",224654,321,59014,731,3691,369,3229,307,12467,488,13169,508,13336,288,11401,573,1721,261,165640,716
310M300US11580,11580,"Arcadia, FL Micro Area",34547,132,6639,372,272,97,454,118,1589,200,1550,185,1806,221,876,206,92,49,27908,358
310M300US11620,11620,"Ardmore, OK Micro Area",46392,170,12769,357,1007,161,767,173,2959,208,2593,239,2814,170,1812,249,817,194,33623,361
310M300US11660,11660,"Arkadelphia, AR Micro Area",21743,93,7474,298,318,82,192,80,1008,130,964,116,857,100,3869,265,266,132,14269,295
310M300US11680,11680,"Arkansas City-Winfield, KS Micro Area",34363,132,9445,301,719,144,565,129,1765,182,1918,238,1949,128,2284,260,245,76,24918,305
310M300US11700,11700,"Asheville, NC Metro Area",433259,513,94167,1201,5393,453,4881,588,18990,767,18672,910,20580,637,21553,1096,4098,451,339092,1244
310M300US11740,11740,"Ashland, OH Micro Area",51336,155,13724,464,787,153,540,135,3043,271,2573,270,2747,242,3479,359,555,172,37612,439
310M300US11780,11780,"Ashtabula, OH Micro Area",95259,218,21345,601,1053,149,866,187,5204,368,5025,356,5560,320,3079,355,558,130,73914,594
310M300US11820,11820,"Astoria, OR Micro Area",36728,136,7864,347,456,117,417,130,1449,202,1734,222,1870,141,1697,321,241,89,28864,349
310M300US11860,11860,"Atchison, KS Micro Area",15878,125,5186,301,295,152,165,108,830,172,1027,170,809,122,1940,234,120,74,10692,288
310M300US11900,11900,"Athens, OH Micro Area",64088,168,27079,511,560,117,693,135,1922,230,2203,249,2239,210,17507,477,1955,331,37009,503
310M300US11940,11940,"Athens, TN Micro Area",51004,213,11121,439,514,147,399,116,2402,285,2897,324,2662,208,1998,297,249,116,39883,476
310M300US11980,11980,"Athens, TX Micro Area",76723,238,16879,499,814,207,909,185,3829,293,4095,308,4077,255,2944,350,211,82,59844,492
310M300US12020,12020,"Athens-Clarke County, GA Metro Area",195986,364,69572,1036,2850,331,2597,380,9297,593,8764,557,9407,472,29511,985,7146,582,126414,1043
310M300US12060,12060,"Atlanta-Sandy Springs-Roswell, GA Metro Area",5486954,2772,1580327,6140,107500,2723,81056,2369,323683,3985,332176,4494,339624,3023,313087,4937,83201,2580,3906627,6021
310M300US12100,12100,"Atlantic City-Hammonton, NJ Metro Area",264038,464,67755,1139,4487,453,2856,355,13014,723,13882,661,14750,500,16148,974,2618,382,196283,1083
310M300US12120,12120,"Atmore, AL Micro Area",36300,174,7875,365,351,117,560,171,1848,229,1894,242,2011,161,1104,270,107,57,28425,361
310M300US12140,12140,"Auburn, IN Micro Area",41163,195,10776,329,756,166,688,160,2423,202,2324,237,2513,155,1828,300,244,121,30387,358
310M300US12180,12180,"Auburn, NY Micro Area",75965,143,16827,430,868,137,881,129,3349,206,3528,231,4181,208,3548,349,472,113,59138,415
310M300US12220,12220,"Auburn-Opelika, AL Metro Area",151226,394,54453,1105,2038,346,1856,375,7348,555,7928,666,7209,390,23068,976,5006,587,96773,1186
310M300US12260,12260,"Augusta-Richmond County, GA-SC Metro Area",567538,795,147650,1752,8498,734,7516,613,31853,1158,30145,1142,33049,823,30254,1210,6335,687,419888,1572
310M300US12300,12300,"Augusta-Waterville, ME Micro Area",117616,229,26804,623,1361,253,1511,247,5271,308,5130,420,5911,355,6392,516,1228,256,90812,620
310M300US12380,12380,"Austin, MN Micro Area",37971,108,9906,325,820,132,802,149,2241,242,1979,219,2338,164,1457,221,269,99,28065,296
310M300US12420,12420,"Austin-Round Rock, TX Metro Area",1922357,1308,547336,3237,35537,1409,26501,1292,109666,2138,108837,2489,99672,1507,135691,2861,31432,1496,1375021,3379
310M300US12460,12460,"Bainbridge, GA Micro Area",26111,199,6429,317,518,170,277,115,1328,296,1699,276,1388,215,1082,223,137,86,19682,387
310M300US12540,12540,"Bakersfield, CA Metro Area",836943,970,256756,2296,12335,740,15158,1003,57654,1697,56248,1452,59570,1139,50241,1913,5550,534,580187,2325
310M300US12580,12580,"Baltimore-Columbia-Towson, MD Metro Area",2694386,1516,719064,3323,47219,1587,36060,1365,133737,1974,134183,1986,141457,1356,170971,2606,55437,1861,1975322,3458
310M300US12620,12620,"Bangor, ME Metro Area",147938,227,38496,830,1647,235,1418,252,6194,433,6317,437,7083,404,13451,820,2386,309,109442,800
310M300US12660,12660,"Baraboo, WI Micro Area",61181,164,14178,383,1130,179,792,117,3514,207,3013,182,3254,168,2178,279,297,73,47003,358
310M300US12680,12680,"Bardstown, KY Micro Area",43433,163,10890,399,846,163,664,154,2195,242,2592,271,2522,188,1628,325,443,151,32543,412
310M300US12700,12700,"Barnstable Town, MA Metro Area",209172,315,39018,766,2534,372,1721,285,7274,413,8158,408,9581,365,7743,658,2007,318,170154,795
310M300US12740,12740,"Barre, VT Micro Area",57257,156,13551,393,815,145,823,222,2399,230,2824,250,2877,210,3270,333,543,109,43706,437
310M300US12780,12780,"Bartlesville, OK Micro Area",49814,116,11995,289,572,117,732,137,2942,217,2772,191,2723,157,1950,226,304,142,37819,297
310M300US12820,12820,"Bastrop, LA Micro Area",25170,212,5308,422,273,130,303,129,1451,222,1249,256,1172,197,778,215,82,51,19862,377
310M300US12860,12860,"Batavia, NY Micro Area",56875,149,12958,392,817,142,729,120,2916,204,2715,248,2924,173,2359,335,498,131,43917,393
310M300US12900,12900,"Batesville, AR Micro Area",35616,161,8990,357,902,204,551,133,2012,221,1773,261,1892,181,1578,273,282,120,26626,319
310M300US12940,12940,"Baton Rouge, LA Metro Area",797284,974,225284,2092,14563,954,9757,829,46710,1388,43540,1524,44259,1038,55750,1856,10705,918,572000,2146
310M300US12980,12980,"Battle Creek, MI Metro Area",129162,283,32139,759,1883,247,1559,211,7060,375,6816,426,7318,327,6654,524,849,231,97023,718
310M300US13020,13020,"Bay City, MI Metro Area",102213,203,24336,518,1219,194,1299,247,5054,338,5135,379,5143,302,5697,444,789,157,77877,539
310M300US13060,13060,"Bay City, TX Micro Area",35124,165,8578,343,625,159,707,209,2080,223,2178,213,1873,159,977,266,138,104,26546,369
310M300US13100,13100,"Beatrice, NE Micro Area",20848,79,4565,184,291,107,198,74,939,133,1204,147,1137,102,600,148,196,75,16283,174
310M300US13140,13140,"Beaumont-Port Arthur, TX Metro Area",393225,678,96322,1498,6475,647,5673,507,22072,880,20660,844,21661,640,16996,1133,2785,419,296903,1464
310M300US13180,13180,"Beaver Dam, WI Micro Area",85462,166,18638,448,1313,182,1042,152,3836,248,4220,244,4728,210,3034,325,465,111,66824,444
310M300US13220,13220,"Beckley, WV Metro Area",117676,298,24870,617,1554,285,1303,258,5669,491,5961,459,5392,279,4154,407,837,209,92806,587
310M300US13260,13260,"Bedford, IN Micro Area",43928,163,10007,368,458,159,658,168,2351,229,2267,259,2330,166,1634,297,309,146,33921,375
310M300US13300,13300,"Beeville, TX Micro Area",31596,138,6908,340,368,141,631,159,1488,251,1715,247,1579,204,1054,285,73,54,24688,341
310M300US13340,13340,"Bellefontaine, OH Micro Area",43521,166,9825,408,541,144,409,132,2437,257,2525,232,2618,208,1094,224,201,71,33696,424
310M300US13380,13380,"Bellingham, WA Metro Area",205533,372,57529,1092,2811,361,2200,324,9392,563,9436,552,9566,477,21965,1131,2159,415,148004,1181
310M300US13420,13420,"Bemidji, MN Micro Area",43693,180,12850,421,768,164,683,145,2602,219,2398,237,2240,184,3682,307,477,149,30843,418
310M300US13460,13460,"Bend-Redmond, OR Metro Area",170176,425,38276,1244,2520,491,1772,392,8030,680,8513,631,8583,471,7615,865,1243,298,131900,1128
310M300US13500,13500,"Bennettsville, SC Micro Area",26668,147,5885,285,337,142,325,135,1109,190,1239,154,1840,247,895,203,140,68,20783,263
310M300US13540,13540,"Bennington, VT Micro Area",35082,135,7888,276,440,134,328,103,1609,182,1635,174,1760,143,1822,200,294,125,27194,249
310M300US13620,13620,"Berlin, NH-VT Micro Area",37419,100,6969,265,451,98,368,93,1476,161,1446,154,1788,135,1195,200,245,80,30450,246
310M300US13660,13660,"Big Rapids, MI Micro Area",41945,101,14238,405,463,105,501,97,1749,164,1856,150,2055,155,7019,417,595,175,27707,415
310M300US13700,13700,"Big Spring, TX Micro Area",36439,193,8304,302,312,111,289,117,1856,219,2095,243,2155,258,1401,238,196,103,28135,345
310M300US13720,13720,"Big Stone Gap, VA Micro Area",56897,193,12406,403,557,116,709,138,2804,271,2643,233,2852,238,2519,294,322,115,44491,403
310M300US13740,13740,"Billings, MT Metro Area",161550,440,37663,665,2238,321,2321,314,9211,424,8421,407,8044,329,6213,438,1215,233,123887,627
310M300US13780,13780,"Binghamton, NY Metro Area",238150,373,63762,1040,3189,416,2662,345,10582,540,11667,529,12183,412,19603,819,3876,559,174388,984
310M300US13820,13820,"Birmingham-Hoover, AL Metro Area",1101484,1023,280375,2133,17091,913,15601,902,58752,1292,59115,1446,60862,809,54929,1451,14025,1038,821109,2111
310M300US13900,13900,"Bismarck, ND Metro Area",123317,301,28929,670,1892,305,1747,274,6993,408,5651,478,5824,298,5616,482,1206,230,94388,721
310M300US13940,13940,"Blackfoot, ID Micro Area",43280,200,13066,450,798,200,749,183,3313,299,2954,332,3080,192,1977,278,195,86,30214,485
310M300US13980,13980,"Blacksburg-Christiansburg-Radford, VA Metro Area",176722,319,62441,951,1547,243,1700,317,6618,430,6367,445,7251,405,32576,863,6382,656,114281,912
310M300US14010,14010,"Bloomington, IL Metro Area",182627,299,59793,1031,3047,292,2440,296,9514,432,9134,513,9247,345,23287,876,3124,483,122834,1113
310M300US14020,14020,"Bloomington, IN Metro Area",161091,277,63397,988,2510,323,1384,279,6137,376,5944,449,6335,336,33053,811,8034,671,97694,930
310M300US14100,14100,"Bloomsburg-Berwick, PA Metro Area",82659,167,21256,562,810,169,848,177,3453,233,3574,258,3479,262,8452,518,640,143,61403,542
310M300US14140,14140,"Bluefield, WV-VA Micro Area",100269,243,21137,552,1053,220,1256,256,5114,329,3950,355,4778,262,4097,437,889,234,79132,535
310M300US14180,14180,"Blytheville, AR Micro Area",41584,237,10882,442,1031,247,551,180,2486,293,2351,320,2637,218,1537,270,289,130,30702,424
310M300US14220,14220,"Bogalusa, LA Micro Area",44757,208,10916,410,710,212,747,219,2498,229,2652,259,2641,266,1452,263,216,113,33841,379
310M300US14260,14260,"Boise City, ID Metro Area",653013,898,183968,1915,9255,797,9595,864,39095,1264,42097,1461,39938,774,36620,1564,7368,696,469045,2071
310M300US14300,14300,"Bonham, TX Micro Area",32816,109,7434,256,453,114,356,109,1325,151,1802,183,2162,182,1149,176,187,79,25382,234
310M300US14340,14340,"Boone, IA Micro Area",25384,172,6202,304,443,103,484,108,1256,172,1138,199,1476,126,1170,247,235,99,19182,259
310M300US14380,14380,"Boone, NC Micro Area",52250,113,20932,594,445,134,577,139,1463,165,1308,168,1700,165,14336,509,1103,280,31318,592
310M300US14420,14420,"Borger, TX Micro Area",20787,110,5275,256,278,102,386,116,1200,157,1145,189,1225,111,972,209,69,36,15512,256
310M300US14460,14460,"Boston-Cambridge-Newton, MA-NH Metro Area",4620015,1850,1230572,4621,78757,1810,55889,1649,208532,2564,221396,2691,239609,1965,313092,3613,113297,2427,3389443,4541
310M300US14500,14500,"Boulder, CO Metro Area",307874,321,96142,1050,5266,407,3639,378,14882,662,14629,630,15016,595,34332,976,8378,504,211732,1009
310M300US14540,14540,"Bowling Green, KY Metro Area",163033,326,47050,994,2027,275,2019,275,8125,435,9018,472,7886,304,16279,846,1696,314,115983,985
310M300US14580,14580,"Bozeman, MT Micro Area",97268,223,29528,763,1556,250,1016,186,4711,299,4548,384,3793,227,12051,645,1853,289,67740,733
310M300US14620,14620,"Bradford, PA Micro Area",40833,124,9192,255,564,120,561,101,1935,186,1725,156,2107,120,2039,218,261,79,31641,284
310M300US14660,14660,"Brainerd, MN Micro Area",89364,169,18873,305,1198,131,970,118,4495,231,4604,236,4560,188,2490,261,556,123,70491,319
310M300US14700,14700,"Branson, MO Micro Area",83311,251,18137,611,1238,261,572,135,3300,333,4380,392,4035,235,4155,508,457,166,65174,639
310M300US14720,14720,"Breckenridge, CO Micro Area",28946,136,5141,500,394,211,195,119,999,191,1229,233,955,167,1160,449,209,131,23805,485
310M300US14740,14740,"Bremerton-Silverdale, WA Metro Area",250116,404,57423,1065,3892,397,3034,394,11881,601,11907,557,12333,485,12083,807,2293,406,192693,989
310M300US14780,14780,"Brenham, TX Micro Area",33618,252,8373,834,518,171,442,148,1327,221,1890,283,1532,286,2505,854,159,112,25245,839
310M300US14820,14820,"Brevard, NC Micro Area",32613,168,6373,322,366,132,169,90,1287,205,1387,237,1496,204,1463,238,205,113,26240,333
310M300US14860,14860,"Bridgeport-Stamford-Norwalk, CT Metro Area",916581,760,254240,1882,17693,883,12018,774,48927,1103,52186,1091,58335,991,51315,1422,13766,812,662341,1727
310M300US15020,15020,"Brookhaven, MS Micro Area",33067,193,8436,417,337,151,520,142,2126,252,1809,228,1961,191,1529,325,154,99,24631,418
310M300US15060,15060,"Brookings, OR Micro Area",21873,128,3147,215,105,53,236,97,778,171,847,172,676,152,342,135,163,122,18726,249
310M300US15100,15100,"Brookings, SD Micro Area",32502,139,13733,418,547,113,481,104,1461,154,1415,192,1245,129,7530,429,1054,266,18769,413
310M300US15140,15140,"Brownsville, TN Micro Area",17239,85,4130,237,196,86,198,79,1032,147,913,114,1221,180,450,135,120,61,13109,241
310M300US15180,15180,"Brownsville-Harlingen, TX Metro Area",399833,746,127140,1520,9160,742,6841,680,29576,926,29624,1145,30528,957,18778,1076,2633,399,272693,1513
310M300US15220,15220,"Brownwood, TX Micro Area",36615,135,8736,308,411,143,447,137,1882,209,2176,231,1966,182,1578,215,276,102,27879,312
310M300US15260,15260,"Brunswick, GA Metro Area",111749,363,26253,733,1818,303,1382,259,5831,490,6175,494,6177,448,4021,519,849,277,85496,725
310M300US15340,15340,"Bucyrus, OH Micro Area",40747,127,8798,307,624,136,385,117,1959,177,2228,192,2230,140,1164,230,208,69,31949,306
310M300US15380,15380,"Buffalo-Cheektowaga-Niagara Falls, NY Metro Area",1099125,651,270967,1900,14502,694,12103,699,50967,1137,53116,1121,57005,862,66126,1386,17148,1062,828158,1835
310M300US15420,15420,"Burley, ID Micro Area",41816,172,11727,323,564,128,778,169,3181,259,2926,262,2874,222,1268,215,136,60,30089,312
310M300US15460,15460,"Burlington, IA-IL Micro Area",45113,165,10082,263,678,155,597,127,2036,208,2729,276,2328,191,1487,206,227,82,35031,254
310M300US15500,15500,"Burlington, NC Metro Area",152608,367,40622,839,2115,286,2000,271,7648,538,7972,461,9214,428,10277,661,1396,269,111986,888
310M300US15540,15540,"Burlington-South Burlington, VT Metro Area",210799,365,57766,963,3458,339,2411,287,8987,528,9162,456,10978,463,18841,771,3929,450,153033,938
310M300US15580,15580,"Butte-Silver Bow, MT Micro Area",33174,177,7696,356,316,127,578,137,1602,185,1343,189,1299,149,2306,275,252,118,25478,353
310M300US15620,15620,"Cadillac, MI Micro Area",46047,109,10236,220,548,97,680,98,2516,169,2549,184,2479,131,1320,164,144,42,35811,201
310M300US15660,15660,"Calhoun, GA Micro Area",54346,250,13690,477,974,261,930,264,2918,376,3716,419,2928,222,1859,351,365,201,40656,475
310M300US15680,15680,"California-Lexington Park, MD Metro Area",106753,260,30421,704,1564,276,1482,284,6216,447,5811,551,6350,394,6980,588,2018,329,76332,706
310M300US15700,15700,"Cambridge, MD Micro Area",31263,125,6591,246,392,106,284,93,1681,190,1272,177,1591,126,1067,226,304,105,24672,293
310M300US15740,15740,"Cambridge, OH Micro Area",37974,142,8756,335,638,129,477,135,1785,201,2145,274,1983,162,1490,252,238,102,29218,315
310M300US15780,15780,"Camden, AR Micro Area",28401,146,6248,280,425,135,417,114,1521,243,1419,282,1308,154,1025,172,133,79,22153,259
310M300US15820,15820,"Campbellsville, KY Micro Area",24351,162,6217,421,228,96,383,154,904,253,1343,250,1307,198,1856,338,196,113,18134,453
310M300US15860,15860,"Cañon City, CO Micro Area",45831,128,8105,341,667,136,534,157,1552,182,1881,202,2152,221,1154,240,165,90,37726,345
310M300US15900,15900,"Canton, IL Micro Area",34725,88,8002,253,579,99,443,92,1498,177,1704,161,1948,144,1549,218,281,90,26723,242
310M300US15940,15940,"Canton-Massillon, OH Metro Area",389121,503,96063,1328,6144,514,4299,372,18911,678,21034,786,21125,575,20899,1045,3651,443,293058,1361
310M300US15980,15980,"Cape Coral-Fort Myers, FL Metro Area",679743,711,138913,1832,6952,623,7239,653,27717,1093,31565,978,29857,820,29813,1589,5770,679,540830,1762
310M300US16020,16020,"Cape Girardeau, MO-IL Metro Area",93682,235,26879,629,1194,221,1281,186,5300,369,4211,362,4588,277,9071,587,1234,220,66803,593
310M300US16060,16060,"Carbondale-Marion, IL Metro Area",122019,280,36323,731,1724,284,876,215,5418,389,6098,373,5204,323,13696,668,3307,393,85696,728
310M300US16100,16100,"Carlsbad-Artesia, NM Micro Area",53994,264,13536,420,791,216,797,211,3509,324,3396,271,3225,259,1577,317,241,112,40458,410
310M300US16140,16140,"Carroll, IA Micro Area",19713,76,4808,190,338,78,388,97,1214,147,944,167,1169,112,628,133,127,64,14905,188
310M300US16180,16180,"Carson City, NV Metro Area",52656,168,12683,468,654,210,543,164,2337,269,2728,306,2828,283,3037,381,556,267,39973,459
310M300US16220,16220,"Casper, WY Metro Area",78071,263,19616,573,1216,242,1282,231,4085,301,4301,342,3922,267,4002,461,808,183,58455,621
310M300US16260,16260,"Cedar City, UT Micro Area",46135,257,16265,729,873,213,789,222,3263,309,2687,317,2919,240,5397,579,337,128,29870,686
310M300US16300,16300,"Cedar Rapids, IA Metro Area",256328,440,66687,906,4873,371,3539,392,13198,605,15107,613,13793,410,13683,741,2494,298,189641,979
310M300US16340,16340,"Cedartown, GA Micro Area",39770,208,10310,435,718,212,525,159,2446,302,2627,362,2218,236,1541,304,235,106,29460,397
310M300US16380,16380,"Celina, OH Micro Area",39088,137,9780,276,748,124,558,120,2013,204,2644,225,2458,158,1233,245,126,68,29308,285
310M300US16420,16420,"Central City, KY Micro Area",30310,135,6503,381,328,103,422,192,1497,221,1423,176,1724,185,992,314,117,66,23807,412
310M300US16460,16460,"Centralia, IL Micro Area",36923,113,8463,282,708,124,621,136,1886,205,2091,188,1614,115,1339,192,204,69,28460,258
310M300US16500,16500,"Centralia, WA Micro Area",73559,193,16286,443,1010,179,872,179,3571,299,3566,294,4003,210,2839,368,425,146,57273,489
310M300US16540,16540,"Chambersburg-Waynesboro, PA Metro Area",147812,326,32973,588,1331,286,1902,266,7636,490,7794,558,8183,389,5009,406,1118,218,114839,569
310M300US16580,16580,"Champaign-Urbana, IL Metro Area",229978,357,87218,1229,3651,444,2725,313,9935,642,10053,564,10210,370,39213,1034,11431,766,142760,1232
310M300US16620,16620,"Charleston, WV Metro Area",212424,396,44664,748,2341,354,2369,313,10684,545,9701,539,10416,391,7116,613,2037,315,167760,699
310M300US16660,16660,"Charleston-Mattoon, IL Micro Area",61559,151,19198,556,766,173,867,186,2577,262,2912,283,2766,205,8163,477,1147,328,42361,555
310M300US16700,16700,"Charleston-North Charleston, SC Metro Area",717141,719,184567,1878,11359,731,10450,895,38406,1238,35396,1151,36521,873,42219,1468,10216,788,532574,1775
310M300US16740,16740,"Charlotte-Concord-Gastonia, NC-SC Metro Area",2336351,1513,622928,3218,38956,1407,32811,1355,133010,2572,134854,2184,135942,1627,120566,2291,26789,1109,1713423,3320
310M300US16820,16820,"Charlottesville, VA Metro Area",221896,363,62952,885,3517,346,2648,363,10660,553,9697,586,10041,468,20264,839,6125,453,158944,908
310M300US16860,16860,"Chattanooga, TN-GA Metro Area",529431,624,127159,1425,7203,541,6090,543,25416,993,27285,1025,26310,669,29812,1350,5043,537,402272,1614
310M300US16940,16940,"Cheyenne, WY Metro Area",93651,278,23925,723,1307,246,1302,257,5544,339,4842,361,4560,342,4948,515,1422,274,69726,774
310M300US16980,16980,"Chicago-Naperville-Elgin, IL-IN-WI Metro Area",9203659,2393,2507010,6873,171018,2212,121380,2532,497669,3889,509696,3929,535267,2886,520283,5565,151697,3002,6696649,6976
310M300US17020,17020,"Chico, CA Metro Area",218051,401,64792,1086,3351,415,2608,312,10335,516,9302,637,10885,446,25884,1041,2427,429,153259,1142
310M300US17060,17060,"Chillicothe, OH Micro Area",74767,220,16881,541,1083,197,937,205,3771,319,3727,326,4516,286,2379,385,468,142,57886,541
310M300US17140,17140,"Cincinnati, OH-KY-IN Metro Area",2078010,1264,553271,3111,35460,1076,28010,1187,115017,1781,117086,1884,117489,1503,114372,2113,25837,1203,1524739,3368
310M300US17200,17200,"Claremont-Lebanon, NH-VT Micro Area",211279,277,47708,687,2428,288,2504,262,8369,466,9155,543,9749,276,12014,600,3489,471,163571,737
